{
  "schemaVersion": 2,
  "commandId": "11111111-1111-4111-8111-111111111111",
  "sessionId": "22222222-2222-4222-8222-222222222222",
  "runnerEpoch": 1,
  "type": "SUBMIT_TASK",
  "taskId": "33333333-3333-4333-8333-333333333333",
  "attemptId": "44444444-4444-4444-8444-444444444444",
  "payload": {
    "message": "修复错误\\n这是输入，不是shell：$(touch /tmp/probe-never)",
    "expectedPublishedHead": "aaaaaaaaaaaaaaaaaaaaaaaaaaaaaaaaaaaaaaaa",
    "deadlineAt": "2099-01-01T00:00:00Z",
    "runtimeConfigDigest": "025ae4e1a047e924acf89630f631a60ac52b2ac4fcfbda0ddc8b9006e4b7e879",
    "worklineStatus": "ACTIVE"
  },
  "worklineId": "00000000-0000-4000-8000-000000000003"
}
