{
  "schemaVersion": 2,
  "commandId": "11111111-1111-4111-8111-111111111111",
  "sessionId": "22222222-2222-4222-8222-222222222222",
  "runnerEpoch": 1,
  "type": "ACK_CHECKPOINT",
  "taskId": null,
  "attemptId": null,
  "payload": {
    "exportId": "eeeeeeee-eeee-eeee-eeee-eeeeeeeeeeee",
    "archiveId": "aaaaaaaa-aaaa-aaaa-aaaa-aaaaaaaaaaaa",
    "bundleSha256": "aaaaaaaaaaaaaaaaaaaaaaaaaaaaaaaaaaaaaaaaaaaaaaaaaaaaaaaaaaaaaaaa",
    "coveredThrough": 42
  },
  "worklineId": "00000000-0000-4000-8000-000000000003"
}
