{
  "schemaVersion": 2,
  "commandId": "00000000-0000-4000-8000-000000000001",
  "sessionId": "00000000-0000-4000-8000-000000000002",
  "worklineId": "00000000-0000-4000-8000-000000000003",
  "runnerEpoch": 4,
  "type": "SUBMIT_TASK",
  "taskId": "00000000-0000-4000-8000-000000000005",
  "attemptId": "00000000-0000-4000-8000-000000000006",
  "payload": {
    "message": "分析并修复分页边界；需要提交时调用显式发布工具。",
    "expectedPublishedHead": "1111111111111111111111111111111111111111",
    "deadlineAt": "2026-10-08T12:00:00Z",
    "runtimeConfigDigest": "aaaaaaaaaaaaaaaaaaaaaaaaaaaaaaaaaaaaaaaaaaaaaaaaaaaaaaaaaaaaaaaa",
    "worklineStatus": "ACTIVE"
  }
}
