{
  "schemaVersion": 2,
  "commandId": "11111111-1111-4111-8111-111111111111",
  "sessionId": "22222222-2222-4222-8222-222222222222",
  "runnerEpoch": 1,
  "type": "STOP_WORKER",
  "taskId": null,
  "attemptId": null,
  "payload": {
    "confirmedArchiveId": "aaaaaaaa-aaaa-aaaa-aaaa-aaaaaaaaaaaa"
  },
  "worklineId": "00000000-0000-4000-8000-000000000003"
}
